{
  "id": "antigravity",
  "display_name": "Antigravity",
  "product_name": "Antigravity CLI",
  "command": "agy",
  "package_name": "relay-antigravity",
  "runner_script": "backends/antigravity/run_antigravity_delegate.ps1",
  "default_surface": "antigravity",
  "capabilities": {
    "json_output": false,
    "whatif_supported": true,
    "timeout_wrapped": false,
    "interactive_approval_control": true,
    "file_attachment_support": false,
    "model_selection_support": true
  },
  "config_schema_version": 1,
  "docs_path": "backends/antigravity/skill-backend.md"
}
