{
  "id": "opencode",
  "display_name": "OpenCode",
  "product_name": "OpenCode",
  "command": "opencode",
  "package_name": "relay-opencode",
  "runner_script": "backends/opencode/run_opencode_delegate.ps1",
  "default_surface": "opencode",
  "capabilities": {
    "json_output": true,
    "whatif_supported": true,
    "timeout_wrapped": true,
    "interactive_approval_control": true,
    "file_attachment_support": true,
    "model_selection_support": true
  },
  "config_schema_version": 1,
  "docs_path": "backends/opencode/skill-backend.md"
}
